{
  "$schema": "../spec/adapter-spec.v2.schema.json",
  "specVersion": "2.0.0",
  "adapterId": "cursor-acp",
  "displayName": "Cursor ACP",
  "implementation": {
    "package": "@openscout/agent-sessions",
    "entrypoint": "src/adapters/cursor-acp/adapter.ts",
    "factoryExport": "createAdapter"
  },
  "upstream": {
    "kind": "mixed",
    "name": "Cursor CLI ACP",
    "transport": "jsonrpc-stdio-jsonl",
    "sources": [
      { "kind": "url", "ref": "https://cursor.com/docs/cli/acp" },
      { "kind": "url", "ref": "https://agentclientprotocol.com/protocol/v1/schema" },
      { "kind": "file", "ref": "src/adapters/cursor-acp/adapter.ts" },
      { "kind": "file", "ref": "src/adapters/acp/adapter.ts" }
    ]
  },
  "sessionModel": {
    "lifecycle": "long_lived_process",
    "conversationScope": "session",
    "resumeSupport": "optional",
    "resumeOptionKey": "sessionId",
    "turnSteering": "new_turn_only",
    "concurrentTurns": "single",
    "persistence": ["process_state", "upstream_session_id"]
  },
  "capabilities": {
    "promptInputs": { "text": true, "images": "native", "files": "reference_text" },
    "outputBlocks": ["text", "reasoning", "action", "error", "question"],
    "actionKinds": ["tool_call"],
    "streaming": { "text": true, "reasoning": true, "actionOutput": true, "actionStatus": true },
    "interactive": { "questions": "native", "approvals": "native", "serverRequests": "native" },
    "control": { "interrupt": true, "shutdown": true }
  },
  "nativeProtocol": {
    "outboundRequests": ["initialize", "authenticate", "session/new", "session/load", "session/resume", "session/prompt", "session/close"],
    "outboundNotifications": ["session/cancel"],
    "inboundNotifications": ["session/update", "cursor/update_todos", "cursor/task", "cursor/image"],
    "inboundServerRequests": ["session/request_permission", "fs/read_text_file", "fs/write_text_file", "cursor/ask_question", "cursor/create_plan"],
    "messageFormats": ["jsonrpc_request", "jsonrpc_notification", "jsonrpc_response", "jsonrpc_error", "jsonl_transport"],
    "serverRequestStrategy": "resolve_and_reject"
  },
  "normalizedSurface": {
    "adapterMethods": ["start", "send", "interrupt", "shutdown"],
    "optionalAdapterMethods": ["decide", "answerQuestion"],
    "emitsPairingEvents": ["session:update", "turn:start", "block:start", "block:delta", "block:question:answer", "block:action:output", "block:action:status", "block:action:approval", "block:end", "turn:error", "turn:end"]
  },
  "conformance": {
    "status": "grandfathered",
    "normalizerId": "acp",
    "fixtureSets": ["acp"]
  },
  "limitations": [
    "Cursor authentication is owned by the separately installed Cursor CLI or CURSOR_API_KEY.",
    "Headless Scout invocations skip Cursor questions and reject plan approvals instead of hanging without an operator surface.",
    "Historical Cursor transcript discovery is not implemented in this adapter."
  ]
}
